texto,url-post
"Photo by McCoy and Ashley in Canadian National Exhibition with @saycheeeesetoast_canada, and @cnefoundation. La imagen puede contener: una o varias personas y comida.",https://instagram.fgye6-1.fna.fbcdn.net/v/t51.2885-15/sh0.08/e35/c0.180.1440.1440a/s640x640/130439484_1358415041171669_7678670786242328094_n.jpg?_nc_ht=instagram.fgye6-1.fna.fbcdn.net&_nc_cat=105&_nc_ohc=eWvouxtt60QAX-85xLG&tp=1&oh=dbdab4ed08d3d0907c5f2c068e85ccbd&oe=6038FFBE
"Photo by Éxitos Tv Venezuela on December 05, 2020. La imagen puede contener: texto que dice ""YO NO @exitostvvzla VOTO"".",https://instagram.fgye6-1.fna.fbcdn.net/v/t51.2885-15/sh0.08/e35/s640x640/129410993_680240252601579_4734255877380669129_n.jpg?_nc_ht=instagram.fgye6-1.fna.fbcdn.net&_nc_cat=103&_nc_ohc=P64YrIwA1wsAX_OFq6R&tp=1&oh=e9d70d9548ad5ab1497e090ba8adb615&oe=6037430F
"Photo by Diario Panorama on November 15, 2020. La imagen puede contener: 1 persona, de pie, texto que dice ""POLÍTICA Y ECONOMÍA cne CNE: Estamos muy complacidos de la participación en el simulacro PANORAMA"".",https://instagram.fgye6-1.fna.fbcdn.net/v/t51.2885-15/e15/c0.90.720.720a/s640x640/125348572_433828064270048_5222227394469183717_n.jpg?_nc_ht=instagram.fgye6-1.fna.fbcdn.net&_nc_cat=108&_nc_ohc=MYKi-infvxgAX9R061q&tp=1&oh=448d826fbf2f5a8add241cc1dc29d730&oe=603614A2
"Photo by Ebi Camacho on January 05, 2021. La imagen puede contener: 1 persona, texto que dice ""Nacional TC rtu Noticias CENTRO ANDRÉS ARAUZ NO ASISTIRA AL DEBATE PRESIDENCIAL www. canalrtu.tv"".",https://instagram.fgye6-1.fna.fbcdn.net/v/t51.2885-15/sh0.08/e35/s640x640/135892395_3426119410946422_2848644257055645201_n.jpg?_nc_ht=instagram.fgye6-1.fna.fbcdn.net&_nc_cat=110&_nc_ohc=07hfq4SKJuwAX83LUNb&tp=1&oh=16bda5ccfec28b6b546ba44bf7e5564a&oe=60390FB4
"Photo by @hustle_horst on January 14, 2021. La imagen puede contener: exterior.",https://instagram.fgye6-1.fna.fbcdn.net/v/t51.2885-15/e15/c182.0.715.715a/s640x640/137636539_221757619485019_1320808473375839209_n.jpg?_nc_ht=instagram.fgye6-1.fna.fbcdn.net&_nc_cat=107&_nc_ohc=HszrZwwnPZIAX_TIMO7&tp=1&oh=b2d96960cf3ce04c6b47571f417768db&oe=6037E041
"Photo shared by José Domingo Blanco on December 04, 2020 tagging @neoadolfo, @rcr750, and @mingoblancotv. La imagen puede contener: 2 personas, personas de pie y teléfono.",https://instagram.fgye6-1.fna.fbcdn.net/v/t51.2885-15/sh0.08/e35/c0.89.780.780a/s640x640/129136206_138000904499451_2608480560249961332_n.jpg?_nc_ht=instagram.fgye6-1.fna.fbcdn.net&_nc_cat=103&_nc_ohc=2aivB48kpj8AX8ITmxM&tp=1&oh=97927f2f6da57ab2b7e26f8379d9af77&oe=6039C0B1
"Photo by Noticiero Venevision on December 06, 2020. La imagen puede contener: 1 persona, texto que dice ""AODER ELECTORAL ZLIC POLÍTICA PRIMER BALANCE CNE: GANA EL GRAN POLO PATRIÓTICO CON 3.558.320 VOTOS, REPRESENTADO EL 67,6%"".",https://instagram.fgye6-1.fna.fbcdn.net/v/t51.2885-15/sh0.08/e35/s640x640/129740209_950198575509764_312118540169298860_n.jpg?_nc_ht=instagram.fgye6-1.fna.fbcdn.net&_nc_cat=108&_nc_ohc=WxAHFdlx2zkAX9Yu7zQ&tp=1&oh=4396672ace0b42584bc22749106ecb7d&oe=60370EA0
"Photo by ¡Farándula Rosa con humor! on December 07, 2020. La imagen puede contener: 2 personas, texto que dice ""Lenles Siempre! traidores nunca. Winston Vallenilla @vwinstonv ¡Viva la Patria Viva el Pueblo sabio y Victorioso. Gracias Familiaaaa por tanto amor DIOS BENDIGA A VENEZUELA #Parlamentarias2020 #MirandaVota"".",https://instagram.fgye6-1.fna.fbcdn.net/v/t51.2885-15/sh0.08/e35/c0.135.1080.1080a/s640x640/130407465_830923040809496_8419866576745722129_n.jpg?_nc_ht=instagram.fgye6-1.fna.fbcdn.net&_nc_cat=108&_nc_ohc=aEdoiisDJgkAX-OK3Ea&tp=1&oh=3d24fa43aed8e07fa665f29ef91bde51&oe=60364673
"Photo by 🇻🇪 @diarioelvistazo Venezuela in Anzoátegui. La imagen puede contener: 4 personas, texto que dice ""#Parlamentarias2020 6D elvistazo diario Resultados CNE Circuito 1 del estado Anzoátegui Numeros del Consejo Nacional Electoral en su página web Ernesto Paraqueima MAS 12,46% 11,17% 1,41% 3,85% 2,63% 0,88% Lemark Gómez PSUV 27, 27,63% 26,07% 37,45% 31,38% 35,60% 30,28% Lilys Osuna Primero Venezuela 4,33% 4,57% 2,39% 4,05% 5,30% 5,53% Ramón Lira Acción Democrática 3,90% 5,39% 6,85% 7,87% 4,17% 8,65% Municipio Simón Rodríguez Municipio Guanipa Municipio Freites Municipio Miranda Monagas Municipio Independencia @diarioelvistazo"".",https://instagram.fgye6-1.fna.fbcdn.net/v/t51.2885-15/sh0.08/e35/s640x640/130724917_806670139927845_7694291516135537164_n.jpg?_nc_ht=instagram.fgye6-1.fna.fbcdn.net&_nc_cat=109&_nc_ohc=V_KtYkt6jdoAX8rkp0K&tp=1&oh=586652d82273c69d6adf267eb49d95a2&oe=6037EC3C
